{"candidate": "c009", "parent": "c008", "source_hash": "b074ce68157c1ff83772e197b7efe3e25e67dd7bdad798e698d437726a314184", "design": "Design B row-blocking, identical kernel to c008; only BLOCK_ROWS 8 -> 16 (grid=cdiv(rows,16), BLOCK_H=4096, num_warps=16). Doubles atomic/shared-load amortization per program.", "hypothesis": "H4b: larger BLOCK_ROWS further reduces atomic-flush count and shared-weight reloads, improving geomean (watch small-B tail waste)", "change_from_parent": "BLOCK_ROWS 8 -> 16 (pure launch/tiling config; math unchanged)", "validation": {"analytic_checks": "kernel math identical to c008 (verified); local accumulators still pure row-sums; lmask tail guard unchanged", "shape_dtype_audit": "unchanged from c008; PASSED on evaluator"}, "per_workload": [{"uuid": "fcd64c92-9a71-592e-ab33-71843be9270f", "B": 64, "S": 613, "status": "PASSED", "pass": true, "speedup": 8.8463, "ref_ms": 88.068676, "sol_ms": 9.955465, "max_abs": 0.03125, "max_rel": 0.0078125}, {"uuid": "5834489e-1f51-5995-b499-8765bd31a705", "B": 64, "S": 128, "status": "PASSED", "pass": true, "speedup": 8.5116, "ref_ms": 18.9612455, "sol_ms": 2.227682, "max_abs": 0.03125, "max_rel": 0.0078125}, {"uuid": "f2508211-757f-5c74-a08a-621ce070f77d", "B": 4, "S": 256, "status": "PASSED", "pass": true, "speedup": 6.7148, "ref_ms": 2.890779, "sol_ms": 0.430507, "max_abs": 0.03125, "max_rel": 0.007751937955617905}, {"uuid": "e9c4303d-4391-5cb3-a6e1-674c1d19bbfd", "B": 64, "S": 256, "status": "PASSED", "pass": true, "speedup": 8.7571, "ref_ms": 37.1535635, "sol_ms": 4.24268, "max_abs": 0.03125, "max_rel": 0.0078125}, {"uuid": "a6c812e5-eb06-5abe-a527-84583b7e08ba", "B": 8, "S": 373, "status": "PASSED", "pass": true, "speedup": 7.7698, "ref_ms": 7.2327855, "sol_ms": 0.930883, "max_abs": 0.03125, "max_rel": 0.0078125}], "geomean_speedup": 8.078221129042534, "all_pass": true, "decision": "keep", "reason": "IMPROVED: 5/5 PASSED, geomean 8.0782x vs c008 7.5515x (+7.0%). Every workload gained, incl. small-B f2508211 (5.69->6.71x) - larger block still nets positive despite tail. New best. Diminishing vs c008's +64%; next c010 tries BLOCK_ROWS=32 to find the knee (grid at BR=32: fcd64c92->1226 programs still saturates 108 SMs; f2508211 1024 rows->32 programs may underfill 108 SMs, a risk to watch).", "cumulative_evals": 9, "skills_used": [], "tokens_note": "eval 9 of 100 budget; new best geomean 8.0782x"}
{"candidate": "c010", "parent": "c009", "source_hash": "5f5cd836564d62b9b1400fa3f88e6595d6931b34a7e8960b6248fc53267f9ce8", "design": "Design B row-blocking, identical kernel to c008/c009; only BLOCK_ROWS 16 -> 32 (grid=cdiv(rows,32), BLOCK_H=4096, num_warps=16). Probes the amortization knee.", "hypothesis": "H4c: BLOCK_ROWS=32 finds the knee of atomic/shared-load amortization; risk that small-B f2508211 (1024 rows -> 32 programs) underfills the 108-SM A800", "change_from_parent": "BLOCK_ROWS 16 -> 32 (pure config; math unchanged)", "validation": {"analytic_checks": "kernel math identical to c009 (verified); config-only change", "shape_dtype_audit": "unchanged"}, "per_workload": [], "geomean_speedup": null, "all_pass": null, "decision": "invalidated", "reason": "EVALUATION INVALIDATED BY CONTROLLER (exit code 3): foreign GPU process detected mid-run (pid 230196, ~1986 MiB used_memory) on g0056 gpu1 at 2026-09-18T04:48:12+08:00. No per-workload timing/correctness was produced (feedback.json contains only kda_controller.monitor.foreign_process_detected=true). This is environmental interference, NOT a property of the c010 source. Best valid candidate remains c009 (geomean 8.0782x). c010 source hash is fixed; it can be re-evaluated UNCHANGED under the same candidate id next turn once the GPU is uncontended. Not counted as a genuine measurement against the search.", "cumulative_evals": 9, "cumulative_eval_attempts": 10, "skills_used": [], "tokens_note": "eval attempt 10 invalidated by foreign-process interference; no usable result; best remains c009 8.0782x"}
{"candidate": "c011", "parent": "c009", "source_hash": "5f5cd836564d62b9b1400fa3f88e6595d6931b34a7e8960b6248fc53267f9ce8", "design": "Design B row-blocking; BLOCK_ROWS=32 (grid=cdiv(rows,32), BLOCK_H=4096, num_warps=16). Same source that the controller invalidated as c010 (foreign-process); re-run under a fresh id since the c010 id was locked. Probes the amortization knee vs c009 (BLOCK_ROWS=16).", "hypothesis": "H4c: BLOCK_ROWS=32 finds/pushes past the amortization knee; risk small-B f2508211 (1024 rows -> 32 programs) underfills the 108-SM A800", "change_from_parent": "BLOCK_ROWS 16 -> 32 (pure config; math identical to c009)", "validation": {"analytic_checks": "kernel math identical to c009 (verified); config-only", "shape_dtype_audit": "unchanged; PASSED on evaluator (correct, just slower)"}, "per_workload": [{"uuid": "fcd64c92-9a71-592e-ab33-71843be9270f", "B": 64, "S": 613, "status": "PASSED", "pass": true, "speedup": 8.8951, "ref_ms": 88.068676, "sol_ms": 9.900842, "max_abs": 0.03125, "max_rel": 0.0078125}, {"uuid": "5834489e-1f51-5995-b499-8765bd31a705", "B": 64, "S": 128, "status": "PASSED", "pass": true, "speedup": 8.0766, "ref_ms": 18.9612455, "sol_ms": 2.347665, "max_abs": 0.03125, "max_rel": 0.0078125}, {"uuid": "f2508211-757f-5c74-a08a-621ce070f77d", "B": 4, "S": 256, "status": "PASSED", "pass": true, "speedup": 4.4948, "ref_ms": 2.890779, "sol_ms": 0.643144, "max_abs": 0.03125, "max_rel": 0.007751937955617905}, {"uuid": "e9c4303d-4391-5cb3-a6e1-674c1d19bbfd", "B": 64, "S": 256, "status": "PASSED", "pass": true, "speedup": 8.8765, "ref_ms": 37.1535635, "sol_ms": 4.185607, "max_abs": 0.03125, "max_rel": 0.0078125}, {"uuid": "a6c812e5-eb06-5abe-a527-84583b7e08ba", "B": 8, "S": 373, "status": "PASSED", "pass": true, "speedup": 8.1147, "ref_ms": 7.2327855, "sol_ms": 0.891316, "max_abs": 0.03125, "max_rel": 0.0078125}], "geomean_speedup": 7.470000068781656, "all_pass": true, "decision": "revert", "reason": "REGRESSION vs c009: geomean 7.4700x < 8.0782x (-7.5%). Correct (5/5) but slower. Root cause is the predicted SM underfill: small-B f2508211 (1024 rows -> 32 programs at BR=32) collapses to 4.4948x (was 6.71x at BR=16) on a 108-SM A800; large-row workloads barely moved. BLOCK_ROWS knee is at 16 -> keep c009 as best. Revert to BLOCK_ROWS=16. Next pivot: num_warps sweep (8 vs 16) on the c009 config, a knob orthogonal to occupancy-underfill.", "cumulative_evals": 10, "cumulative_eval_attempts": 11, "skills_used": [], "tokens_note": "eval 10 (attempt 11) of budget; c009 remains best at 8.0782x"}
{"candidate": "c012", "parent": "c009", "source_hash": "7f7be73208934c404291f33f1bad5e8d9d62645dbfa577e8e1e37cff72493b67", "design": "Design B row-blocking, identical kernel/math to c009 (BLOCK_ROWS=16, BLOCK_H=4096); only num_warps 16 -> 8.", "hypothesis": "num_warps=8 raises per-SM occupancy (more concurrent blocks) and cuts intra-block reduction/scheduling overhead given the 44% masked lanes at BLOCK_H=4096, improving geomean", "change_from_parent": "num_warps 16 -> 8 (pure launch config; math identical to c009)", "validation": {"analytic_checks": "kernel math identical to c009 (verified); config-only change", "shape_dtype_audit": "unchanged; PASSED on evaluator"}, "per_workload": [{"uuid": "fcd64c92-9a71-592e-ab33-71843be9270f", "B": 64, "S": 613, "status": "PASSED", "pass": true, "speedup": 14.0395, "ref_ms": 88.068676, "sol_ms": 6.272907, "max_abs": 0.03125, "max_rel": 0.0078125}, {"uuid": "5834489e-1f51-5995-b499-8765bd31a705", "B": 64, "S": 128, "status": "PASSED", "pass": true, "speedup": 13.5573, "ref_ms": 18.9612455, "sol_ms": 1.398605, "max_abs": 0.03125, "max_rel": 0.0078125}, {"uuid": "f2508211-757f-5c74-a08a-621ce070f77d", "B": 4, "S": 256, "status": "PASSED", "pass": true, "speedup": 8.4082, "ref_ms": 2.890779, "sol_ms": 0.343804, "max_abs": 0.03125, "max_rel": 0.007751937955617905}, {"uuid": "e9c4303d-4391-5cb3-a6e1-674c1d19bbfd", "B": 64, "S": 256, "status": "PASSED", "pass": true, "speedup": 13.62, "ref_ms": 37.1535635, "sol_ms": 2.727867, "max_abs": 0.03125, "max_rel": 0.0078125}, {"uuid": "a6c812e5-eb06-5abe-a527-84583b7e08ba", "B": 8, "S": 373, "status": "PASSED", "pass": true, "speedup": 11.5164, "ref_ms": 7.2327855, "sol_ms": 0.62804, "max_abs": 0.03125, "max_rel": 0.0078125}], "geomean_speedup": 12.021115957734906, "all_pass": true, "decision": "keep", "reason": "BIG WIN: 5/5 PASSED, geomean 12.0211x vs c009 8.0782x (+48.8%). num_warps=8 was a major lever - at BLOCK_H=4096 (256 threads) each SM now fits more concurrent blocks (higher occupancy) and reduction overhead drops. Every workload jumped ~1.5x. Same numerics. New best. Next c013: try num_warps=4 to see if the occupancy trend continues, or 32 to bound it; and reconsider BLOCK_ROWS at the new warp count (interactions).", "cumulative_evals": 11, "cumulative_eval_attempts": 12, "skills_used": [], "tokens_note": "eval 11 (attempt 12); new best geomean 12.0211x"}
{"candidate": "c013", "parent": "c012", "source_hash": "d19095423b97fba6ce78564a677cad8788a0b15191c01dcd4b8fdd844c861992", "design": "Design B row-blocking, identical kernel/math to c012 (BLOCK_ROWS=16, BLOCK_H=4096); only num_warps 8 -> 4.", "hypothesis": "num_warps=4 continues the occupancy trend seen at 16->8 and improves further", "change_from_parent": "num_warps 8 -> 4 (pure config; math identical)", "validation": {"analytic_checks": "kernel math identical to c012 (verified); config-only", "shape_dtype_audit": "unchanged; PASSED on evaluator"}, "per_workload": [{"uuid": "fcd64c92-9a71-592e-ab33-71843be9270f", "B": 64, "S": 613, "status": "PASSED", "pass": true, "speedup": 7.9451, "ref_ms": 88.068676, "sol_ms": 11.084651, "max_abs": 0.03125, "max_rel": 0.0078125}, {"uuid": "5834489e-1f51-5995-b499-8765bd31a705", "B": 64, "S": 128, "status": "PASSED", "pass": true, "speedup": 7.3109, "ref_ms": 18.9612455, "sol_ms": 2.593548, "max_abs": 0.03125, "max_rel": 0.0078125}, {"uuid": "f2508211-757f-5c74-a08a-621ce070f77d", "B": 4, "S": 256, "status": "PASSED", "pass": true, "speedup": 5.8545, "ref_ms": 2.890779, "sol_ms": 0.493769, "max_abs": 0.03125, "max_rel": 0.007751937955617905}, {"uuid": "e9c4303d-4391-5cb3-a6e1-674c1d19bbfd", "B": 64, "S": 256, "status": "PASSED", "pass": true, "speedup": 7.6881, "ref_ms": 37.1535635, "sol_ms": 4.832576, "max_abs": 0.03125, "max_rel": 0.0078125}, {"uuid": "a6c812e5-eb06-5abe-a527-84583b7e08ba", "B": 8, "S": 373, "status": "PASSED", "pass": true, "speedup": 7.3242, "ref_ms": 7.2327855, "sol_ms": 0.987523, "max_abs": 0.03125, "max_rel": 0.0078125}], "geomean_speedup": 7.185030794412651, "all_pass": true, "decision": "revert", "reason": "REGRESSION vs c012: geomean 7.1850x < 12.0211x (-40%). Correct (5/5) but much slower. num_warps=4 (128 threads/block over BLOCK_H=4096 => 32 elems/lane) over-serializes each row's H-reductions; 8 warps is the clear peak. num_warps curve now: 16->8.08 (c009), 8->12.02 (c012 BEST), 4->7.19 (c013). Revert to c012 (num_warps=8). Next c014: probe BLOCK_ROWS interaction at the winning num_warps=8 (try BR=8 and/or BR=24/32) since the BR knee measured earlier was at num_warps=16 and may shift.", "cumulative_evals": 12, "cumulative_eval_attempts": 13, "skills_used": [], "tokens_note": "eval 12 (attempt 13); c012 remains best at 12.0211x"}
{"candidate": "c014", "parent": "c012", "source_hash": "16f98479565970611294b476dca5c3ca542ebf24d558fb45db93b544214cc9b2", "design": "Design B row-blocking, identical kernel/math to c012; BLOCK_ROWS 16 -> 8 at the winning num_warps=8 (BLOCK_H=4096). Tests BRxnum_warps interaction (BR knee was measured at num_warps=16).", "hypothesis": "At num_warps=8 the BR knee may shift lower; BR=8 gives more programs (better small-B occupancy) and may beat c012's BR=16", "change_from_parent": "BLOCK_ROWS 16 -> 8 (pure config; num_warps=8 as c012; math identical)", "validation": {"analytic_checks": "kernel math identical to c012 (verified); config-only", "shape_dtype_audit": "unchanged; PASSED on evaluator"}, "per_workload": [{"uuid": "fcd64c92-9a71-592e-ab33-71843be9270f", "B": 64, "S": 613, "status": "PASSED", "pass": true, "speedup": 12.2431, "ref_ms": 88.068676, "sol_ms": 7.193343, "max_abs": 0.03125, "max_rel": 0.0078125}, {"uuid": "5834489e-1f51-5995-b499-8765bd31a705", "B": 64, "S": 128, "status": "PASSED", "pass": true, "speedup": 11.8038, "ref_ms": 18.9612455, "sol_ms": 1.606362, "max_abs": 0.03125, "max_rel": 0.0078125}, {"uuid": "f2508211-757f-5c74-a08a-621ce070f77d", "B": 4, "S": 256, "status": "PASSED", "pass": true, "speedup": 7.4576, "ref_ms": 2.890779, "sol_ms": 0.387627, "max_abs": 0.03125, "max_rel": 0.007751937955617905}, {"uuid": "e9c4303d-4391-5cb3-a6e1-674c1d19bbfd", "B": 64, "S": 256, "status": "PASSED", "pass": true, "speedup": 12.0375, "ref_ms": 37.1535635, "sol_ms": 3.086487, "max_abs": 0.03125, "max_rel": 0.0078125}, {"uuid": "a6c812e5-eb06-5abe-a527-84583b7e08ba", "B": 8, "S": 373, "status": "PASSED", "pass": true, "speedup": 10.0723, "ref_ms": 7.2327855, "sol_ms": 0.718087, "max_abs": 0.03125, "max_rel": 0.0078125}], "geomean_speedup": 10.549597332314857, "all_pass": true, "decision": "revert", "reason": "REGRESSION vs c012: geomean 10.5496x < 12.0211x (-12%). Correct (5/5) but slower. At num_warps=8 the BR knee stays at 16, not 8 - BR=8 halves per-program amortization of the grad_rw/grad_nw atomic flush and shared-weight reload, and the extra programs don't help since 108 SMs are already saturated at BR=16 for 4/5 workloads. Confirms c012 (BR=16, nw=8) is the joint optimum of the two config knobs. Sweep summary at nw=8: BR=8->10.55, BR=16->12.02(BEST). Revert to c012. Config knobs (BLOCK_ROWS, num_warps) now jointly exhausted around 12.0x.", "cumulative_evals": 13, "cumulative_eval_attempts": 14, "skills_used": [], "tokens_note": "eval 13 (attempt 14); c012 remains best at 12.0211x"}
{"candidate": "c015", "parent": "c012", "source_hash": "40f50d85bdcb27890018ff9510cf05078e2c5167622f6cc59097d354fa65ae61", "design": "Design B row-blocking, identical kernel/math to c012 (BR=16, BLOCK_H=4096, num_warps=8); only the per-program row loop changed from plain `range(BLOCK_ROWS)` to `tl.range(BLOCK_ROWS, num_stages=2)` to software-pipeline the row iterations (overlap next row's HBM loads with current row's compute).", "hypothesis": "software-pipelining the row loop (num_stages=2) overlaps load latency with compute and improves throughput on the memory-bound kernel", "change_from_parent": "row loop range -> tl.range(..., num_stages=2) (pipelining hint; math identical)", "validation": {"analytic_checks": "kernel math identical to c012 (verified); pipelining is a scheduling hint only, results unchanged; local accumulators still summed across all rows", "shape_dtype_audit": "unchanged; PASSED on evaluator"}, "per_workload": [{"uuid": "fcd64c92-9a71-592e-ab33-71843be9270f", "B": 64, "S": 613, "status": "PASSED", "pass": true, "speedup": 13.5026, "ref_ms": 88.068676, "sol_ms": 6.522328, "max_abs": 0.03125, "max_rel": 0.0078125}, {"uuid": "5834489e-1f51-5995-b499-8765bd31a705", "B": 64, "S": 128, "status": "PASSED", "pass": true, "speedup": 13.0426, "ref_ms": 18.9612455, "sol_ms": 1.453788, "max_abs": 0.03125, "max_rel": 0.0078125}, {"uuid": "f2508211-757f-5c74-a08a-621ce070f77d", "B": 4, "S": 256, "status": "PASSED", "pass": true, "speedup": 8.2463, "ref_ms": 2.890779, "sol_ms": 0.350555, "max_abs": 0.03125, "max_rel": 0.007751937955617905}, {"uuid": "e9c4303d-4391-5cb3-a6e1-674c1d19bbfd", "B": 64, "S": 256, "status": "PASSED", "pass": true, "speedup": 13.0829, "ref_ms": 37.1535635, "sol_ms": 2.83985, "max_abs": 0.03125, "max_rel": 0.0078125}, {"uuid": "a6c812e5-eb06-5abe-a527-84583b7e08ba", "B": 8, "S": 373, "status": "PASSED", "pass": true, "speedup": 11.2707, "ref_ms": 7.2327855, "sol_ms": 0.641736, "max_abs": 0.03125, "max_rel": 0.0078125}], "geomean_speedup": 11.645002301192214, "all_pass": true, "decision": "revert", "reason": "SMALL REGRESSION vs c012: geomean 11.6450x < 12.0211x (-3.1%). Correct (5/5) but slower. Pipelining the row loop increases live-register pressure (two rows' working sets in flight) at BLOCK_H=4096, lowering occupancy more than the load/compute overlap gains at num_warps=8. c012's plain loop is better. Revert to c012. This exhausts the loop-pipelining knob on top of the already-exhausted BLOCK_ROWS and num_warps knobs.", "cumulative_evals": 14, "cumulative_eval_attempts": 15, "skills_used": [], "tokens_note": "eval 14 (attempt 15); c012 remains best at 12.0211x; config+pipeline knobs exhausted"}



