{"id": "c005", "parent": "c004", "source_sha256": "d3aea2c3945849cd3db7b9c5bae87a186c8415019dcc892c6ef0d21cba33ec9f", "hypothesis": "Widening the KV tile (BLOCK_N 64->128) halves the KV-loop trip count on the large/compute-bound cases, doing 2x the wgmma per iteration and amortizing per-iter overhead (loop control + online-softmax reductions + m_i/l_i updates), improving large-case throughput. Tiny cases (kv_len<=71<BLOCK_N, single tile) expected ~neutral.", "change_from_parent": "kernel launch param only: BLOCK_N 64 -> 128. Kernel body and host launch logic byte-identical to c004.", "config": {"BLOCK_M": 128, "BLOCK_N": 128, "num_warps": 8, "num_stages": 3, "grid": "V1-dense; sync-free for total_q<=128", "qk_precision": "bf16-dot-fp32-accum", "launch": "sync-free-small + no-memset (torch.empty)", "host_syncs": "0 for total_q<=128, else 1", "causal_skip": true}, "validation": {"correct": true, "workloads_passed": 21, "workloads_total": 21, "failures": [], "tolerance": {"atol": 0.01, "rtol": 0.01, "matched_ratio": 0.99}}, "per_workload": [{"uuid": "f7a038e9-6c18-4fd6-9b79-e349a4c79bd8", "regime": "tiny", "axes": {"total_q": 7, "len_indptr": 2}, "correct": true, "speedup": 8.26}, {"uuid": "f4c23a33-b16b-4ee8-bb86-440562adf047", "regime": "micro", "axes": {"total_q": 1, "len_indptr": 2}, "correct": true, "speedup": 7.60}, {"uuid": "bad384fa-037d-474f-9a09-0e9f1bb8f43e", "regime": "tiny", "axes": {"total_q": 35, "len_indptr": 2}, "correct": true, "speedup": 8.67}, {"uuid": "2068cdff-fad7-43d3-b018-490349ad9776", "regime": "small", "axes": {"total_q": 81, "len_indptr": 3}, "correct": true, "speedup": 15.34}, {"uuid": "6f3e1bfe-2209-4921-9be4-beed5c9744cb", "regime": "large", "axes": {"total_q": 13557, "len_indptr": 26}, "correct": true, "speedup": 33.44}, {"uuid": "adefedc4-d82a-43ca-800e-51557b08b446", "regime": "large", "axes": {"total_q": 12845, "len_indptr": 37}, "correct": true, "speedup": 36.78}, {"uuid": "fab48473-c925-43b8-90b8-3110ede3e6a7", "regime": "tiny", "axes": {"total_q": 7, "len_indptr": 2}, "correct": true, "speedup": 8.10}, {"uuid": "3a919718-bdfb-4030-8771-7e2cca27ada7", "regime": "micro", "axes": {"total_q": 1, "len_indptr": 2}, "correct": true, "speedup": 7.42}, {"uuid": "32f5e961-dd46-4ac3-bb3d-bbc2e30053db", "regime": "tiny", "axes": {"total_q": 35, "len_indptr": 2}, "correct": true, "speedup": 8.48}, {"uuid": "daa2d149-ff35-4038-8195-eb293f8566cd", "regime": "tiny", "axes": {"total_q": 35, "len_indptr": 2}, "correct": true, "speedup": 8.44}, {"uuid": "ef683298-131d-4c81-9d1d-4db82b7f7896", "regime": "tiny", "axes": {"total_q": 18, "len_indptr": 2}, "correct": true, "speedup": 8.09}, {"uuid": "568a6016-6234-4700-ae5e-061593e16640", "regime": "tiny", "axes": {"total_q": 18, "len_indptr": 2}, "correct": true, "speedup": 8.50}, {"uuid": "b8f94163-51d0-4a6f-8af1-6721221cfd67", "regime": "tiny", "axes": {"total_q": 7, "len_indptr": 2}, "correct": true, "speedup": 8.24}, {"uuid": "bdc49f9e-f294-40c8-925e-a3b3ac6fc335", "regime": "micro", "axes": {"total_q": 1, "len_indptr": 2}, "correct": true, "speedup": 7.20}, {"uuid": "da9042ea-dc64-44aa-ba6d-1a90b834f6d8", "regime": "tiny", "axes": {"total_q": 35, "len_indptr": 2}, "correct": true, "speedup": 8.60}, {"uuid": "58701318-6136-4577-afb1-7a3b9418bd79", "regime": "tiny", "axes": {"total_q": 35, "len_indptr": 2}, "correct": true, "speedup": 8.44}, {"uuid": "2328b031-69cc-4217-8e14-e341dd418733", "regime": "small", "axes": {"total_q": 982, "len_indptr": 16}, "correct": true, "speedup": 42.05}, {"uuid": "012bb8e4-3c30-414f-ab5e-8d63cbbce70f", "regime": "tiny", "axes": {"total_q": 71, "len_indptr": 2}, "correct": true, "speedup": 8.20}, {"uuid": "370287f0-5dc3-4c0a-9a00-9162fb2ddbd4", "regime": "tiny", "axes": {"total_q": 71, "len_indptr": 2}, "correct": true, "speedup": 8.40}, {"uuid": "7a08a0f6-7dd4-4de9-bb5b-847c51969faa", "regime": "large", "axes": {"total_q": 12571, "len_indptr": 11}, "correct": true, "speedup": 31.12}, {"uuid": "dc8c1d18-3976-48c0-bdf1-f9bcb999cdd4", "regime": "small", "axes": {"total_q": 92, "len_indptr": 6}, "correct": true, "speedup": 31.10}], "geomean_speedup": 11.87, "arithmetic_mean_speedup": 14.88, "min_speedup": 7.20, "max_speedup": 42.05, "decision": "revert", "cumulative_evaluations": 5, "skills_used": ["KernelWiki"], "notes": "REVERT: geomean 11.93->11.87x (-0.06), 21/21 correct but net regression. BLOCK_N=128 was ~neutral-to-slightly-negative on the large cases (#5 34.36->33.44, #20 31.55->31.12; #6 slightly up 36.42->36.78, #17 44.08->42.05), and tiny cases within noise. Interpretation: at BLOCK_N=64 the large-case KV loop was already latency-hidden by num_stages=3, and doubling BLOCK_N raises per-iter register/smem pressure (bigger qk/p [128,128] tile) without a throughput win; the extra work per iter offsets the fewer iters. Confirms c004 (BLOCK_N=64, num_stages=3) is the branch-A optimum among {stages, BLOCK_N}. Best remains c004 @ 11.93x. Decaying/plateaued returns: c003->c004 +0.22, c004->c005 -0.06. The geomean is tiny-dominated and the 17 launch-bound cases sit at their ~0.05ms single-launch floor (constant across c003/c004/c005), so no launch-side headroom remains; the large cases are pipeline-saturated at BLOCK_M=128/BLOCK_N=64/stages=3. Search has effectively converged. One more low-risk branch-A probe worth a single eval before declaring done: num_warps 8->4 on parent c004, which could lower tiny-case launch/scheduling cost (the dominant geomean term) without hurting the large cases much. Next candidate c006: num_warps=4 (parent c004). If c006 does not beat 11.93x, write SEARCH_COMPLETE with c004 as best. Next parent: c004 (NOT c005)."}
{"id": "c006", "parent": "c004", "source_sha256": "38c6cc9cf4c12e2ed9b488c94ab1b83c16bdb7f3579cb022cc165fa1b7fc3c06", "hypothesis": "Halving warps per CTA (num_warps 8->4) lowers per-CTA register/scheduling overhead on the dominant launch-bound tiny cases (grid (batch,32,1), trivial single-tile work), improving the geomean, while the large cases lose at most a little wgmma throughput. Final branch-A launch-side probe from parent c004 (BLOCK_N restored to 64).", "change_from_parent": "kernel launch param only: num_warps 8 -> 4 (parent c004; BLOCK_M=128, BLOCK_N=64, num_stages=3). Kernel body and host launch logic byte-identical to c004.", "config": {"BLOCK_M": 128, "BLOCK_N": 64, "num_warps": 4, "num_stages": 3, "grid": "V1-dense; sync-free for total_q<=128", "qk_precision": "bf16-dot-fp32-accum", "launch": "sync-free-small + no-memset (torch.empty)", "host_syncs": "0 for total_q<=128, else 1", "causal_skip": true}, "validation": {"correct": true, "workloads_passed": 21, "workloads_total": 21, "failures": [], "tolerance": {"atol": 0.01, "rtol": 0.01, "matched_ratio": 0.99}}, "per_workload": [{"uuid": "f7a038e9-6c18-4fd6-9b79-e349a4c79bd8", "regime": "tiny", "axes": {"total_q": 7, "len_indptr": 2}, "correct": true, "speedup": 8.39}, {"uuid": "f4c23a33-b16b-4ee8-bb86-440562adf047", "regime": "micro", "axes": {"total_q": 1, "len_indptr": 2}, "correct": true, "speedup": 7.91}, {"uuid": "bad384fa-037d-474f-9a09-0e9f1bb8f43e", "regime": "tiny", "axes": {"total_q": 35, "len_indptr": 2}, "correct": true, "speedup": 8.27}, {"uuid": "2068cdff-fad7-43d3-b018-490349ad9776", "regime": "small", "axes": {"total_q": 81, "len_indptr": 3}, "correct": true, "speedup": 15.57}, {"uuid": "6f3e1bfe-2209-4921-9be4-beed5c9744cb", "regime": "large", "axes": {"total_q": 13557, "len_indptr": 26}, "correct": true, "speedup": 28.51}, {"uuid": "adefedc4-d82a-43ca-800e-51557b08b446", "regime": "large", "axes": {"total_q": 12845, "len_indptr": 37}, "correct": true, "speedup": 28.31}, {"uuid": "fab48473-c925-43b8-90b8-3110ede3e6a7", "regime": "tiny", "axes": {"total_q": 7, "len_indptr": 2}, "correct": true, "speedup": 7.47}, {"uuid": "3a919718-bdfb-4030-8771-7e2cca27ada7", "regime": "micro", "axes": {"total_q": 1, "len_indptr": 2}, "correct": true, "speedup": 8.51}, {"uuid": "32f5e961-dd46-4ac3-bb3d-bbc2e30053db", "regime": "tiny", "axes": {"total_q": 35, "len_indptr": 2}, "correct": true, "speedup": 8.89}, {"uuid": "daa2d149-ff35-4038-8195-eb293f8566cd", "regime": "tiny", "axes": {"total_q": 35, "len_indptr": 2}, "correct": true, "speedup": 8.32}, {"uuid": "ef683298-131d-4c81-9d1d-4db82b7f7896", "regime": "tiny", "axes": {"total_q": 18, "len_indptr": 2}, "correct": true, "speedup": 8.61}, {"uuid": "568a6016-6234-4700-ae5e-061593e16640", "regime": "tiny", "axes": {"total_q": 18, "len_indptr": 2}, "correct": true, "speedup": 8.66}, {"uuid": "b8f94163-51d0-4a6f-8af1-6721221cfd67", "regime": "tiny", "axes": {"total_q": 7, "len_indptr": 2}, "correct": true, "speedup": 8.29}, {"uuid": "bdc49f9e-f294-40c8-925e-a3b3ac6fc335", "regime": "micro", "axes": {"total_q": 1, "len_indptr": 2}, "correct": true, "speedup": 7.76}, {"uuid": "da9042ea-dc64-44aa-ba6d-1a90b834f6d8", "regime": "tiny", "axes": {"total_q": 35, "len_indptr": 2}, "correct": true, "speedup": 8.82}, {"uuid": "58701318-6136-4577-afb1-7a3b9418bd79", "regime": "tiny", "axes": {"total_q": 35, "len_indptr": 2}, "correct": true, "speedup": 8.28}, {"uuid": "2328b031-69cc-4217-8e14-e341dd418733", "regime": "small", "axes": {"total_q": 982, "len_indptr": 16}, "correct": true, "speedup": 37.85}, {"uuid": "012bb8e4-3c30-414f-ab5e-8d63cbbce70f", "regime": "tiny", "axes": {"total_q": 71, "len_indptr": 2}, "correct": true, "speedup": 10.14}, {"uuid": "370287f0-5dc3-4c0a-9a00-9162fb2ddbd4", "regime": "tiny", "axes": {"total_q": 71, "len_indptr": 2}, "correct": true, "speedup": 9.22}, {"uuid": "7a08a0f6-7dd4-4de9-bb5b-847c51969faa", "regime": "large", "axes": {"total_q": 12571, "len_indptr": 11}, "correct": true, "speedup": 25.26}, {"uuid": "dc8c1d18-3976-48c0-bdf1-f9bcb999cdd4", "regime": "small", "axes": {"total_q": 92, "len_indptr": 6}, "correct": true, "speedup": 31.12}], "geomean_speedup": 11.79, "arithmetic_mean_speedup": 14.01, "min_speedup": 7.47, "max_speedup": 37.85, "decision": "revert", "cumulative_evaluations": 6, "skills_used": ["KernelWiki"], "notes": "REVERT: geomean 11.93->11.79x (-0.14), 21/21 correct but net regression. Clear tradeoff as hypothesized but net-negative: tiny/micro cases improved a little (e.g. #18 8.38->10.14, #19 8.55->9.22, several ~8.3->8.6-8.9) BUT the 4 compute-bound cases dropped sharply because 4 warps under-feed the tensor cores: #5 34.36->28.51, #6 36.42->28.31, #20 31.55->25.26, #17 44.08->37.85. Because the large-case losses (each a big multiplicative factor in the geomean) outweigh the small tiny-case gains, net geomean falls. Confirms num_warps=8 is correct for this kernel (needs 8 warps to saturate wgmma on the large cases). Both remaining branch-A knobs now tested and both regress: BLOCK_N=128 (c005, -0.06) and num_warps=4 (c006, -0.14). SEARCH CONVERGED. Best valid candidate = c004 (geomean 11.93x, 21/21 correct, BLOCK_M=128, BLOCK_N=64, num_warps=8, num_stages=3). Writing SEARCH_COMPLETE; c004 restored as the submission source. Parent for record purposes: c004."}
